### ISSUE TITLE
Several reachability issues in multiple subnet per VPC

### ISSUE THREAD

**Issue by pau-hedgehog** [githedgehog/fabricator#564]
When running the release tests:

```
20:39:34 INF Running pings, iperfs and curls servers=9                                                                                                                                                             20:44:39 [11/5195]20:44:39 ERR Error(s) during testing connectivity                                                                                                                                                                                    
20:44:39 ERR Error key=vpcpeer--server-5--server-2 err="checking ping from server-5 to server-2: should be reachable but ping failed with output: PING 10.10.1.4 (10.10.1.4) 56(84) bytes of data.\n\n--- 10.10.1.4 ping statistics ---\n3 packets transmitted, 0 received, 100% packet loss, time 2073ms"                                                                                                                                                                
20:44:39 ERR Error key=vpcpeer--server-8--server-5 err="checking iperf from server-8 to server-5: running iperf3: iperf3 send speed too low: 1485.00 Mbps < 8200.00 Mbps"                                                            
20:44:39 ERR Error key=vpcpeer--server-2--server-9 err="checking ping from server-2 to server-9: should be reachable but ping failed with output: PING 10.10.3.2 (10.10.3.2) 56(84) bytes of data.\n\n--- 10.10.3.2 ping statistics -
--\n3 packets transmitted, 0 received, 100% packet loss, time 2071ms"                                                                                                                                                                20:44:39 ERR Error key=vpcpeer--server-5--server-1 err="checking ping from server-5 to server-1: should be reachable but ping failed with output: PING 10.10.1.2 (10.10.1.2) 56(84) bytes of data.\n\n--- 10.10.1.2 ping statistics -
--\n3 packets transmitted, 0 received, 100% packet loss, time 2073ms"                                                                                                                                                                20:44:39 ERR Error key=vpcpeer--server-5--server-3 err="checking ping from server-5 to server-3: should be reachable but ping failed with output: PING 10.10.1.3 (10.10.1.3) 56(84) bytes of data.\n\n--- 10.10.1.3 ping statistics -
--\n3 packets transmitted, 0 received, 100% packet loss, time 2077ms"                                                                                                                                                                20:44:39 ERR Error key=vpcpeer--server-2--server-6 err="checking iperf from server-2 to server-6: running iperf3: running iperf3 server: Process exited with status 124"                                                             
20:44:39 ERR Error key=vpcpeer--server-9--server-2 err="checking ping from server-9 to server-2: should be reachable but ping failed with output: PING 10.10.1.4 (10.10.1.4) 56(84) bytes of data.\n\n--- 10.10.1.4 ping statistics -
--\n3 packets transmitted, 0 received, 100% packet loss, time 2050ms"
20:44:39 ERR Error key=vpcpeer--server-8--server-2 err="checking ping from server-8 to server-2: unexpected ping result (expected true): PING 10.10.1.4 (10.10.1.4) 56(84) bytes of data.\n64 bytes from 10.10.1.4: icmp_seq=2 ttl=62 time=0.434 ms\n64 bytes from 10.10.1.4: icmp_seq=3 ttl=62 time=0.243 ms\n\n--- 10.10.1.4 ping statistics ---\n3 packets transmitted, 2 received, 33.3333% packet loss, time 2059ms\nrtt min/avg/max/mdev = 0.243/0.338/0.434/0.095 m
s"
20:44:39 ERR Error key=vpcpeer--server-1--server-5 err="checking ping from server-1 to server-5: should be reachable but ping failed with output: PING 10.10.2.4 (10.10.2.4) 56(84) bytes of data.\n\n--- 10.10.2.4 ping statistics -
--\n3 packets transmitted, 0 received, 100% packet loss, time 2040ms"
20:44:39 ERR Error key=vpcpeer--server-7--server-5 err="checking iperf from server-7 to server-5: running iperf3: iperf3 send speed too low: 1144.79 Mbps < 8200.00 Mbps"
20:44:39 ERR Error key=vpcpeer--server-3--server-8 err="checking ping from server-3 to server-8: unexpected ping result (expected true): PING 10.10.3.3 (10.10.3.3) 56(84) bytes of data.\n64 bytes from 10.10.3.3: icmp_seq=2 ttl=62
 time=0.225 ms\n64 bytes from 10.10.3.3: icmp_seq=3 ttl=62 time=0.269 ms\n\n--- 10.10.3.3 ping statistics ---\n3 packets transmitted, 2 received, 33.3333% packet loss, time 2079ms\nrtt min/avg/max/mdev = 0.225/0.247/0.269/0.022 ms"
20:44:39 ERR Error key=vpcpeer--server-8--server-4 err="checking ping from server-8 to server-4: unexpected ping result (expected true): PING 10.10.2.2 (10.10.2.2) 56(84) bytes of data.\n64 bytes from 10.10.2.2: icmp_seq=2 ttl=62 time=0.323 ms\n64 bytes from 10.10.2.2: icmp_seq=3 ttl=62 time=0.104 ms\n\n--- 10.10.2.2 ping statistics ---\n3 packets transmitted, 2 received, 33.3333% packet loss, time 2067ms\nrtt min/avg/max/mdev = 0.104/0.213/0.323/0.109 m
s"
20:44:39 ERR Error key=vpcpeer--server-6--server-9 err="checking ping from server-6 to server-9: should be reachable but ping failed with output: PING 10.10.3.2 (10.10.3.2) 56(84) bytes of data.\n\n--- 10.10.3.2 ping statistics -
--\n3 packets transmitted, 0 received, 100% packet loss, time 2050ms"
20:44:39 ERR Error key=vpcpeer--server-1--server-6 err="checking ping from server-1 to server-6: should be reachable but ping failed with output: PING 10.10.2.3 (10.10.2.3) 56(84) bytes of data.\n\n--- 10.10.2.3 ping statistics -
--\n3 packets transmitted, 0 received, 100% packet loss, time 2035ms"
20:44:39 ERR Error key=vpcpeer--server-1--server-9 err="checking ping from server-1 to server-9: should be reachable but ping failed with output: PING 10.10.3.2 (10.10.3.2) 56(84) bytes of data.\n\n--- 10.10.3.2 ping statistics -
--\n3 packets transmitted, 0 received, 100% packet loss, time 2052ms"
20:44:39 ERR Error key=vpcpeer--server-2--server-5 err="checking ping from server-2 to server-5: should be reachable but ping failed with output: PING 10.10.2.4 (10.10.2.4) 56(84) bytes of data.\n\n--- 10.10.2.4 ping statistics -
--\n3 packets transmitted, 0 received, 100% packet loss, time 2066ms"
20:44:39 ERR Error key=vpcpeer--server-3--server-6 err="checking iperf from server-3 to server-6: running iperf3: running iperf3 server: Process exited with status 124"
20:44:39 ERR Error key=vpcpeer--server-3--server-9 err="checking ping from server-3 to server-9: should be reachable but ping failed with output: PING 10.10.3.2 (10.10.3.2) 56(84) bytes of data.\n\n--- 10.10.3.2 ping statistics -
--\n3 packets transmitted, 0 received, 100% packet loss, time 2085ms"
20:44:39 ERR Error key=vpcpeer--server-3--server-5 err="checking ping from server-3 to server-5: should be reachable but ping failed with output: PING 10.10.2.4 (10.10.2.4) 56(84) bytes of data.\n\n--- 10.10.2.4 ping statistics -
--\n3 packets transmitted, 0 received, 100% packet loss, time 2081ms"
20:44:39 ERR Error key=vpcpeer--server-2--server-8 err="checking ping from server-2 to server-8: unexpected ping result (expected true): PING 10.10.3.3 (10.10.3.3) 56(84) bytes of data.\n64 bytes from 10.10.3.3: icmp_seq=2 ttl=62
 time=0.219 ms\n64 bytes from 10.10.3.3: icmp_seq=3 ttl=62 time=0.212 ms\n\n--- 10.10.3.3 ping statistics ---\n3 packets transmitted, 2 received, 33.3333% packet loss, time 2067ms\nrtt min/avg/max/mdev = 0.212/0.215/0.219/0.003 m
s"
20:44:39 ERR Error key=vpcpeer--server-5--server-7 err="checking iperf from server-5 to server-7: running iperf3: iperf3 send speed too low: 27.33 Mbps < 8200.00 Mbps"
20:44:39 ERR Error key=vpcpeer--server-9--server-6 err="checking ping from server-9 to server-6: should be reachable but ping failed with output: PING 10.10.2.3 (10.10.2.3) 56(84) bytes of data.\n\n--- 10.10.2.3 ping statistics -
--\n3 packets transmitted, 0 received, 100% packet loss, time 2034ms"
20:44:39 ERR Error key=vpcpeer--server-6--server-3 err="checking iperf from server-6 to server-3: running iperf3: running iperf3 server: Process exited with status 124"
20:44:39 ERR Error key=vpcpeer--server-4--server-9 err="checking ping from server-4 to server-9: should be reachable but ping failed with output: PING 10.10.3.2 (10.10.3.2) 56(84) bytes of data.\n\n--- 10.10.3.2 ping statistics -
--\n3 packets transmitted, 0 received, 100% packet loss, time 2063ms"
20:44:39 ERR Error key=vpcpeer--server-9--server-4 err="checking ping from server-9 to server-4: should be reachable but ping failed with output: PING 10.10.2.2 (10.10.2.2) 56(84) bytes of data.\n\n--- 10.10.2.2 ping statistics -
--\n3 packets transmitted, 0 received, 100% packet loss, time 2050ms"
20:44:39 ERR Error key=vpcpeer--server-1--server-7 err="checking ping from server-1 to server-7: unexpected ping result (expected true): PING 10.10.3.4 (10.10.3.4) 56(84) bytes of data.\n64 bytes from 10.10.3.4: icmp_seq=2 ttl=62
 time=0.411 ms\n64 bytes from 10.10.3.4: icmp_seq=3 ttl=62 time=0.126 ms\n\n--- 10.10.3.4 ping statistics ---\n3 packets transmitted, 2 received, 33.3333% packet loss, time 2041ms\nrtt min/avg/max/mdev = 0.126/0.268/0.411/0.142 m
s"
20:44:39 ERR Error key=vpcpeer--server-9--server-3 err="checking ping from server-9 to server-3: should be reachable but ping failed with output: PING 10.10.1.3 (10.10.1.3) 56(84) bytes of data.\n\n--- 10.10.1.3 ping statistics -
--\n3 packets transmitted, 0 received, 100% packet loss, time 2065ms"
20:44:39 ERR Error key=vpcpeer--server-6--server-1 err="checking ping from server-6 to server-1: unexpected ping result (expected true): PING 10.10.1.2 (10.10.1.2) 56(84) bytes of data.\n64 bytes from 10.10.1.2: icmp_seq=1 ttl=63
 time=34.5 ms\n\n--- 10.10.1.2 ping statistics ---\n3 packets transmitted, 1 received, 66.6667% packet loss, time 2042ms\nrtt min/avg/max/mdev = 34.454/34.454/34.454/0.000 ms"
20:44:39 ERR Error key=vpcpeer--server-4--server-8 err="checking ping from server-4 to server-8: unexpected ping result (expected true): PING 10.10.3.3 (10.10.3.3) 56(84) bytes of data.\n64 bytes from 10.10.3.3: icmp_seq=2 ttl=62
 time=0.200 ms\n64 bytes from 10.10.3.3: icmp_seq=3 ttl=62 time=0.186 ms\n\n--- 10.10.3.3 ping statistics ---\n3 packets transmitted, 2 received, 33.3333% packet loss, time 2062ms\nrtt min/avg/max/mdev = 0.186/0.193/0.200/0.007 m
s"
20:44:39 ERR Error key=vpcpeer--server-6--server-2 err="checking iperf from server-6 to server-2: running iperf3: running iperf3 server: Process exited with status 124"
20:44:39 ERR Error key=vpcpeer--server-5--server-8 err="checking iperf from server-5 to server-8: running iperf3: iperf3 send speed too low: 26.76 Mbps < 8200.00 Mbps"
20:44:39 ERR Error key=vpcpeer--server-9--server-1 err="checking ping from server-9 to server-1: should be reachable but ping failed with output: PING 10.10.1.2 (10.10.1.2) 56(84) bytes of data.\n\n--- 10.10.1.2 ping statistics -
--\n3 packets transmitted, 0 received, 100% packet loss, time 2036ms"
20:44:39 ERR FAIL test="No restrictions" error="testing connectivity: testing connectivity: testing connectivity from \"server-1\" to \"server-7\": checking ping from server-1 to server-7: unexpected ping result (expected true): 
PING 10.10.3.4 (10.10.3.4) 56(84) bytes of data.\n64 bytes from 10.10.3.4: icmp_seq=2 ttl=62 time=0.411 ms\n64 bytes from 10.10.3.4: icmp_seq=3 ttl=62 time=0.126 ms\n\n--- 10.10.3.4 ping statistics ---\n3 packets transmitted, 2 r
eceived, 33.3333% packet loss, time 2041ms\nrtt min/avg/max/mdev = 0.126/0.268/0.411/0.142 ms"
```

This is:
```
$ hhfab versions
07:13:53 INF Hedgehog Fabricator version=v0.36.1
07:13:53 INF Wiring hydrated successfully mode=if-not-present
07:13:53 INF Printing versions of all components
fabric:
  agent: v0.71.6
  alloy: v1.1.1
  api: v0.71.6
  boot: v0.71.6
  controller: v0.71.6
  ctl: v0.71.6
  dhcpd: v0.71.6
  nos:
    sonic-bcm-base: v4.4.2
    sonic-bcm-campus: v4.4.2
    sonic-bcm-vs: v4.4.2
  onie:
    x86_64-accton_as4630_54npe-r0: v0.1.0
    x86_64-accton_as7326_56x-r0: v0.1.0
    x86_64-accton_as7712_32x-r0: v0.1.0
    x86_64-accton_as7726_32x-r0: v0.1.0
    x86_64-cel_ds4101-r0: v0.2.0
    x86_64-cel_seastone_2-r0: v0.1.0
    x86_64-cel_silverstone-r0: v0.1.0
    x86_64-dellemc_s5232f_c3538-r0: v0.1.0
    x86_64-dellemc_s5248f_c3538-r0: v0.1.0
    x86_64-dellemc_z9332f_d1508-r0: v0.1.0
    x86_64-kvm_x86_64-r0: v0.1.0
  proxy: 1.9.1
  proxyChart: v0.71.6
fabricator:
  api: v0.36.1
  controlISORoot: v4152.2.0-hh1
  controller: v0.36.1
  ctl: v0.36.1
  flatcar: v4152.2.0
  nodeConfig: v0.36.1
  pause: "3.6"
gateway:
  api: v0.1.2
  controller: v0.1.2
platform:
  certManager: v1.17.1
  k3s: v1.32.1-k3s1
  k9s: v0.40.6
  ntp: v0.0.2
  ntpChart: v0.36.1
  reloader: v1.0.40
  toolbox: latest
  zot: v2.1.1
vlab:
  flatcar: v4152.2.0
  onie: v0.2.0
```

If I do `hhfab vlab conns` after some time:
```
21:41:22 INF Running pings, iperfs and curls servers=9
21:53:14 ERR Error(s) during testing connectivity
21:53:14 ERR Error key=vpcpeer--server-6--server-9 err="checking ping from server-6 to server-9: should be reachable but ping failed with output: PING 10.10.3.2 (10.10.3.2) 56(84) bytes of data.\n\n--- 10.10.3.2 ping statistics ---\n5 packets transmitted, 0 received, 100% packet loss, time 4123ms"
21:53:14 ERR Error key=vpcpeer--server-5--server-8 err="checking iperf from server-5 to server-8: running iperf3: iperf3 send speed too low: 27.05 Mbps < 8200.00 Mbps"
21:53:14 ERR Error key=vpcpeer--server-1--server-6 err="checking ping from server-1 to server-6: should be reachable but ping failed with output: PING 10.10.2.3 (10.10.2.3) 56(84) bytes of data.\n\n--- 10.10.2.3 ping statistics ---\n5 packets transmitted, 0 received, 100% packet loss, time 4075ms"
21:53:14 ERR Error key=vpcpeer--server-5--server-2 err="checking ping from server-5 to server-2: should be reachable but ping failed with output: PING 10.10.1.4 (10.10.1.4) 56(84) bytes of data.\n\n--- 10.10.1.4 ping statistics ---\n5 packets transmitted, 0 received, 100% packet loss, time 4092ms"
21:53:14 ERR Error key=vpcpeer--server-9--server-6 err="checking ping from server-9 to server-6: should be reachable but ping failed with output: PING 10.10.2.3 (10.10.2.3) 56(84) bytes of data.\n\n--- 10.10.2.3 ping statistics ---\n5 packets transmitted, 0 received, 100% packet loss, time 4080ms"
21:53:14 ERR Error key=vpcpeer--server-6--server-3 err="checking iperf from server-6 to server-3: running iperf3: running iperf3 server: Process exited with status 124"
21:53:14 ERR Error key=vpcpeer--server-4--server-9 err="checking ping from server-4 to server-9: should be reachable but ping failed with output: PING 10.10.3.2 (10.10.3.2) 56(84) bytes of data.\n\n--- 10.10.3.2 ping statistics ---\n5 packets transmitted, 0 received, 100% packet loss, time 4108ms"
21:53:14 ERR Error key=vpcpeer--server-2--server-5 err="checking ping from server-2 to server-5: should be reachable but ping failed with output: PING 10.10.2.4 (10.10.2.4) 56(84) bytes of data.\n\n--- 10.10.2.4 ping statistics ---\n5 packets transmitted, 0 received, 100% packet loss, time 4133ms"
21:53:14 ERR Error key=vpcpeer--server-6--server-2 err="checking iperf from server-6 to server-2: running iperf3: running iperf3 server: Process exited with status 124"
21:53:14 ERR Error key=vpcpeer--server-7--server-5 err="checking iperf from server-7 to server-5: running iperf3: iperf3 send speed too low: 1237.73 Mbps < 8200.00 Mbps"
21:53:14 ERR Error key=vpcpeer--server-9--server-3 err="checking ping from server-9 to server-3: should be reachable but ping failed with output: PING 10.10.1.3 (10.10.1.3) 56(84) bytes of data.\n\n--- 10.10.1.3 ping statistics ---\n5 packets transmitted, 0 received, 100% packet loss, time 4131ms"
21:53:14 ERR Error key=vpcpeer--server-5--server-1 err="checking ping from server-5 to server-1: should be reachable but ping failed with output: PING 10.10.1.2 (10.10.1.2) 56(84) bytes of data.\n\n--- 10.10.1.2 ping statistics ---\n5 packets transmitted, 0 received, 100% packet loss, time 4114ms"
21:53:14 ERR Error key=vpcpeer--server-6--server-1 err="checking ping from server-6 to server-1: should be reachable but ping failed with output: PING 10.10.1.2 (10.10.1.2) 56(84) bytes of data.\n\n--- 10.10.1.2 ping statistics ---\n5 packets transmitted, 0 received, 100% packet loss, time 4126ms"
21:53:14 ERR Error key=vpcpeer--server-2--server-6 err="checking iperf from server-2 to server-6: running iperf3: running iperf3 server: Process exited with status 124"
21:53:14 ERR Error key=vpcpeer--server-3--server-6 err="checking iperf from server-3 to server-6: running iperf3: running iperf3 server: Process exited with status 124"
21:53:14 ERR Error key=vpcpeer--server-2--server-9 err="checking ping from server-2 to server-9: should be reachable but ping failed with output: PING 10.10.3.2 (10.10.3.2) 56(84) bytes of data.\n\n--- 10.10.3.2 ping statistics ---\n5 packets transmitted, 0 received, 100% packet loss, time 4099ms"
21:53:14 ERR Error key=vpcpeer--server-9--server-2 err="checking ping from server-9 to server-2: should be reachable but ping failed with output: PING 10.10.1.4 (10.10.1.4) 56(84) bytes of data.\n\n--- 10.10.1.4 ping statistics ---\n5 packets transmitted, 0 received, 100% packet loss, time 4085ms"
21:53:14 ERR Error key=vpcpeer--server-8--server-5 err="checking iperf from server-8 to server-5: running iperf3: iperf3 send speed too low: 1109.01 Mbps < 8200.00 Mbps"
21:53:14 ERR Error key=vpcpeer--server-9--server-1 err="checking ping from server-9 to server-1: should be reachable but ping failed with output: PING 10.10.1.2 (10.10.1.2) 56(84) bytes of data.\n\n--- 10.10.1.2 ping statistics ---\n5 packets transmitted, 0 received, 100% packet loss, time 4082ms"
21:53:14 ERR Error key=vpcpeer--server-1--server-5 err="checking ping from server-1 to server-5: should be reachable but ping failed with output: PING 10.10.2.4 (10.10.2.4) 56(84) bytes of data.\n\n--- 10.10.2.4 ping statistics ---\n5 packets transmitted, 0 received, 100% packet loss, time 4079ms"
21:53:14 ERR Error key=vpcpeer--server-9--server-4 err="checking ping from server-9 to server-4: should be reachable but ping failed with output: PING 10.10.2.2 (10.10.2.2) 56(84) bytes of data.\n\n--- 10.10.2.2 ping statistics ---\n5 packets transmitted, 0 received, 100% packet loss, time 4073ms"
21:53:14 ERR Error key=vpcpeer--server-3--server-5 err="checking ping from server-3 to server-5: should be reachable but ping failed with output: PING 10.10.2.4 (10.10.2.4) 56(84) bytes of data.\n\n--- 10.10.2.4 ping statistics ---\n5 packets transmitted, 0 received, 100% packet loss, time 4104ms"
21:53:14 ERR Error key=vpcpeer--server-5--server-3 err="checking ping from server-5 to server-3: should be reachable but ping failed with output: PING 10.10.1.3 (10.10.1.3) 56(84) bytes of data.\n\n--- 10.10.1.3 ping statistics ---\n5 packets transmitted, 0 received, 100% packet loss, time 4117ms"
21:53:14 ERR Error key=vpcpeer--server-3--server-9 err="checking ping from server-3 to server-9: should be reachable but ping failed with output: PING 10.10.3.2 (10.10.3.2) 56(84) bytes of data.\n\n--- 10.10.3.2 ping statistics ---\n5 packets transmitted, 0 received, 100% packet loss, time 4108ms"
21:53:14 ERR Error key=vpcpeer--server-1--server-9 err="checking ping from server-1 to server-9: should be reachable but ping failed with output: PING 10.10.3.2 (10.10.3.2) 56(84) bytes of data.\n\n--- 10.10.3.2 ping statistics ---\n5 packets transmitted, 0 received, 100% packet loss, time 4136ms"
21:53:14 ERR Error key=vpcpeer--server-5--server-7 err="checking iperf from server-5 to server-7: running iperf3: iperf3 send speed too low: 27.25 Mbps < 8200.00 Mbps"
21:53:14 ERR test-connectivity: testing connectivity: testing connectivity from "server-1" to "server-6": checking ping from server-1 to server-6: should be reachable but ping failed with output: PING 10.10.2.3 (10.10.2.3) 56(84) bytes of data.

--- 10.10.2.3 ping statistics ---
5 packets transmitted, 0 received, 100% packet loss, time 4075ms
```

**Comment by pau-hedgehog** [comment]
The test is the following:
```
20:37:42 INF Configuring VPCs and VPCAttachments                                                                                                                                                                                     
20:37:42 INF Created vpc=vpc-01 subnets=3                                                                                                                                                                                            
20:37:42 INF Created vpcattachment=server-1--mclag--s5248-01--s5248-02--vpc-01--subnet-01
20:37:42 INF Created vpcattachment=server-2--mclag--s5248-01--s5248-02--vpc-01--subnet-01                                                                                                                                            
20:37:42 INF Created vpcattachment=server-3--bundled--s5248-01--vpc-01--subnet-01                                                                                                                                                    
20:37:42 INF Created vpcattachment=server-4--unbundled--s5248-02--vpc-01--subnet-02
20:37:42 INF Created vpcattachment=server-5--eslag--s5248-03--s5248-04--vpc-01--subnet-02                                                                                                                                            
20:37:42 INF Created vpcattachment=server-6--eslag--s5248-03--s5248-04--vpc-01--subnet-02
20:37:42 INF Created vpcattachment=server-7--unbundled--s5248-03--vpc-01--subnet-03                                                                                                                                                  
20:37:42 INF Created vpcattachment=server-8--unbundled--s5248-03--vpc-01--subnet-03                                                                                                                                                  
20:37:42 INF Created vpcattachment=server-9--unbundled--s5248-04--vpc-01--subnet-03  
```

```
core@control-1 ~ $ kubectl describe vpc vpc-01
Name:         vpc-01
Namespace:    default
Labels:       fabric.githedgehog.com/ipv4ns=default
              fabric.githedgehog.com/vlanns=default
Annotations:  <none>
API Version:  vpc.githedgehog.com/v1beta1
Kind:         VPC
Metadata:
  Creation Timestamp:  2025-04-23T20:37:42Z
  Generation:          1
  Resource Version:    337051
  UID:                 c9fb4e17-99f8-479d-9716-e77bacb453f2
Spec:
  ipv4Namespace:  default
  Subnets:
    subnet-01:
      Dhcp:
        Enable:  true
        Range:
          End:    10.10.1.255
          Start:  10.10.1.2
      Gateway:    10.10.1.1
      Subnet:     10.10.1.0/24
      Vlan:       1001
    subnet-02:
      Dhcp:
        Enable:  true
        Range:
          End:    10.10.2.255
          Start:  10.10.2.2
      Gateway:    10.10.2.1
      Subnet:     10.10.2.0/24
      Vlan:       1002
    subnet-03:
      Dhcp:
        Enable:  true
        Range:
          End:     10.10.3.255
          Start:   10.10.3.2
      Gateway:     10.10.3.1
      Subnet:      10.10.3.0/24
      Vlan:        1003
  Vlan Namespace:  default
Events:            <none>
```

```
core@control-1 ~ $ kubectl get vpcattachments
NAME                                                     VPCSUBNET          CONNECTION                            NATIVEVLAN   AGE
server-1--mclag--s5248-01--s5248-02--vpc-01--subnet-01   vpc-01/subnet-01   server-1--mclag--s5248-01--s5248-02                13h
server-2--mclag--s5248-01--s5248-02--vpc-01--subnet-01   vpc-01/subnet-01   server-2--mclag--s5248-01--s5248-02                13h
server-3--bundled--s5248-01--vpc-01--subnet-01           vpc-01/subnet-01   server-3--bundled--s5248-01                        13h
server-4--unbundled--s5248-02--vpc-01--subnet-02         vpc-01/subnet-02   server-4--unbundled--s5248-02                      13h
server-5--eslag--s5248-03--s5248-04--vpc-01--subnet-02   vpc-01/subnet-02   server-5--eslag--s5248-03--s5248-04                13h
server-6--eslag--s5248-03--s5248-04--vpc-01--subnet-02   vpc-01/subnet-02   server-6--eslag--s5248-03--s5248-04                13h
server-7--unbundled--s5248-03--vpc-01--subnet-03         vpc-01/subnet-03   server-7--unbundled--s5248-03                      13h
server-8--unbundled--s5248-03--vpc-01--subnet-03         vpc-01/subnet-03   server-8--unbundled--s5248-03                      13h
server-9--unbundled--s5248-04--vpc-01--subnet-03         vpc-01/subnet-03   server-9--unbundled--s5248-04                      13h
```

**Comment by pau-hedgehog** [comment]
Diagnosing this flow, which looks like it's going through some of the switches' CPU:
`Error key=vpcpeer--server-5--server-7 err="checking iperf from server-5 to server-7: running iperf3: iperf3 send speed too low: 27.05 Mbps < 8200.00 Mbps"`

server-5:
```
core@server-5 ~ $ ip addr show bond0.1002
34: bond0.1002@bond0: <BROADCAST,MULTICAST,UP,LOWER_UP> mtu 1500 qdisc noqueue state UP group default qlen 1000
    link/ether 42:4c:e4:97:87:76 brd ff:ff:ff:ff:ff:ff
    inet 10.10.2.4/24 metric 1024 brd 10.10.2.255 scope global dynamic bond0.1002
       valid_lft 3075sec preferred_lft 3075sec
    inet6 fe80::404c:e4ff:fe97:8776/64 scope link proto kernel_ll 
       valid_lft forever preferred_lft forever
```

server-7:
```
core@server-7 ~ $ ip addr show enp2s1.1003
20: enp2s1.1003@enp2s1: <BROADCAST,MULTICAST,UP,LOWER_UP> mtu 1500 qdisc noqueue state UP group default qlen 1000
    link/ether 00:e0:ed:7a:e1:cc brd ff:ff:ff:ff:ff:ff
    inet 10.10.3.4/24 metric 1024 brd 10.10.3.255 scope global dynamic enp2s1.1003
       valid_lft 2859sec preferred_lft 2859sec
    inet6 fe80::2e0:edff:fe7a:e1cc/64 scope link proto kernel_ll 
       valid_lft forever preferred_lft forever
```

```
core@server-5 ~ $ toolbox iperf3 -c 10.10.3.4
Spawning container core-ghcr.iogithedgehogtoolbox-latest on /var/lib/toolbox/core-ghcr.io_githedgehog_toolbox-latest.
Press Ctrl-] three times within 1s to kill container.
Connecting to host 10.10.3.4, port 5201
[  5] local 10.10.2.4 port 39628 connected to 10.10.3.4 port 5201
[ ID] Interval           Transfer     Bitrate         Retr  Cwnd
[  5]   0.00-1.00   sec  3.10 MBytes  26.0 Mbits/sec    0    163 KBytes       
[  5]   1.00-2.00   sec  3.11 MBytes  26.1 Mbits/sec    0    304 KBytes       
[  5]   2.00-3.00   sec  2.86 MBytes  24.0 Mbits/sec    0    444 KBytes       
[  5]   3.00-4.00   sec  3.36 MBytes  28.2 Mbits/sec    0    585 KBytes       
[  5]   4.00-5.00   sec  2.73 MBytes  22.9 Mbits/sec    0    721 KBytes       
[  5]   5.00-6.00   sec  3.36 MBytes  28.2 Mbits/sec    0    863 KBytes       
[  5]   6.00-7.00   sec  2.98 MBytes  25.0 Mbits/sec    0    998 KBytes       
[  5]   7.00-8.00   sec  3.36 MBytes  28.2 Mbits/sec    0   1.11 MBytes       
        [  5]   8.00-9.00   sec  2.49 MBytes  20.9 Mbits/sec    0   1.25 MBytes       
[  5]   9.00-10.00  sec  2.50 MBytes  21.0 Mbits/sec    0   1.39 MBytes       
- - - - - - - - - - - - - - - - - - - - - - - - -
[ ID] Interval           Transfer     Bitrate         Retr
[  5]   0.00-10.00  sec  29.8 MBytes  25.0 Mbits/sec    0             sender
[  5]   0.00-10.54  sec  28.7 MBytes  22.9 Mbits/sec                  receiver

iperf Done.
Container core-ghcr.iogithedgehogtoolbox-latest exited successfully.
```

Traffic is going through `s5248-04` CPU:
```
admin@s5248-04:~$ sudo tcpdump -i any -n host 10.10.2.4 and host 10.10.3.4 and port 5201

(...)

11:03:28.778636 Bridge P   IP8 (invalid)
11:03:28.778636 Vlan1002 In  IP 10.10.2.4.58770 > 10.10.3.4.5201: Flags [.], seq 29032437:29033885, ack 1, win 502, options [nop,nop,TS val 377539684 ecr 3249102893], length 1448
11:03:28.778651 Vlan3000 Out IP 10.10.2.4.58770 > 10.10.3.4.5201: Flags [.], seq 29032437:29033885, ack 1, win 502, options [nop,nop,TS val 377539684 ecr 3249102893], length 1448
11:03:28.778653 Bridge Out IP8 (invalid)
11:03:28.778655 vtepfabric-3000 Out IP 10.10.2.4.58770 > 10.10.3.4.5201: Flags [.], seq 29032437:29033885, ack 1, win 502, options [nop,nop,TS val 377539684 ecr 3249102893], length 1448
11:03:28.778682 Ethernet2 P   IP8 (invalid)
11:03:28.778682 PortChannel1 P   IP8 (invalid)
11:03:28.778682 Bridge P   IP8 (invalid)
11:03:28.778682 Vlan1002 In  IP 10.10.2.4.58770 > 10.10.3.4.5201: Flags [.], seq 29033885:29035333, ack 1, win 502, options [nop,nop,TS val 377539684 ecr 3249102893], length 1448
11:03:28.778694 Vlan3000 Out IP 10.10.2.4.58770 > 10.10.3.4.5201: Flags [.], seq 29033885:29035333, ack 1, win 502, options [nop,nop,TS val 377539684 ecr 3249102893], length 1448
11:03:28.778696 Bridge Out IP8 (invalid)
11:03:28.778698 vtepfabric-3000 Out IP 10.10.2.4.58770 > 10.10.3.4.5201: Flags [.], seq 29033885:29035333, ack 1, win 502, options [nop,nop,TS val 377539684 ecr 3249102893], length 1448
^C11:03:28.779636 Ethernet2 P   IP8 (invalid)

131450 packets captured
140618 packets received by filter
8999 packets dropped by kernel
```

```
s5248-04# show ip route vrf VrfVvpc-01
Codes:  K - kernel route, C - connected, S - static, B - BGP, O - OSPF
        > - selected route, * - FIB route, q - queued route, r - rejected route
       Destination        Gateway                                                                    Dist/Metric   Last Update 
--------------------------------------------------------------------------------------------------------------------------------      
 B>*   10.10.1.0/24       via 172.30.12.0                 Vlan3000                                   20/0          14:36:36 ago
 B>*   10.10.1.2/32       via 172.30.12.0                 Vlan3000                                   20/0          14:35:10 ago
 B>*   10.10.1.3/32       via 172.30.12.0                 Vlan3000                                   20/0          14:35:10 ago
 B>*   10.10.1.4/32       via 172.30.12.0                 Vlan3000                                   20/0          14:35:10 ago
 C>*   10.10.2.0/24       Direct                          Vlan1002                                   0/0           14:35:25 ago
 B>*   10.10.2.2/32       via 172.30.12.0                 Vlan3000                                   20/0          14:35:10 ago
 C>*   10.10.3.0/24       Direct                          Vlan1003                                   0/0           14:35:28 ago
 B>*   10.10.3.3/32       via 172.30.12.1                 Vlan3000                                   20/0          14:35:10 ago
 B>*   10.10.3.4/32       via 172.30.12.1                 Vlan3000                                   20/0          14:35:10 ago
```

```
admin@s5248-04:~$ sonic-cli
s5248-04# show ip arp vrf VrfVvpc-01
Type: R - Remote Neighbor entries (EVPN or MCLAG Separate IP)
-------------------------------------------------------------------------------------------------------------------------
Address             Hardware address    Interface            Egress Interface            Type               Action    
-------------------------------------------------------------------------------------------------------------------------
10.10.2.2           00:e0:ed:7a:e1:cb   Vlan1002             VxLAN DIP: 172.30.12.0      Static(R)          Fwd       
10.10.2.3           66:ab:8f:70:ec:0f   Vlan1002             PortChannel2                Dynamic            Fwd       
10.10.2.4           42:4c:e4:97:87:76   Vlan1002             PortChannel1                Dynamic            Fwd       
10.10.3.2           00:e0:ed:45:27:ff   Vlan1003             Ethernet1                   Dynamic            Fwd       
10.10.3.3           00:e0:ed:45:28:01   Vlan1003             VxLAN DIP: 172.30.12.1      Static(R)          Fwd       
10.10.3.4           00:e0:ed:7a:e1:cc   Vlan1003             VxLAN DIP: 172.30.12.1      Static(R)          Fwd       
172.30.12.0         54:bf:64:ba:3d:c2   Vlan3000             -                           Static(R)          Fwd       
172.30.12.1         3c:2c:30:71:1b:04   Vlan3000             -                           Static(R)          Fwd       
s5248-04# 
```

```
drivshell>l3 defip show
l3 defip show
Unit 0, Total Number of DEFIP entries: 98256
#     VRF     Net addr             Next Hop Mac        INTF MODID PORT PRIO CLASS HIT VLAN
11    0        172.30.8.0/32        00:00:00:00:00:00 200001    0     0     0    0 n      (ECMP)
9     0        172.30.8.1/32        00:00:00:00:00:00 200005    0     0     0    0 n      (ECMP)
10    0        172.30.8.2/32        00:00:00:00:00:00 200002    0     0     0    0 n      (ECMP)
10    0        172.30.8.3/32        00:00:00:00:00:00 200002    0     0     0    0 n      (ECMP)
11    0        172.30.8.4/32        00:00:00:00:00:00 200002    0     0     0    0 n      (ECMP)
10    0        172.30.12.0/32       00:00:00:00:00:00 200002    0     0     0    0 n      (ECMP)
12    0        172.30.12.1/32       00:00:00:00:00:00 200002    0     0     0    0 n      (ECMP)
10    0        172.30.95.0/31       00:00:00:00:00:00 200002    0     0     0    0 n      (ECMP)
11    0        172.30.128.0/31      00:00:00:00:00:00 200001    0     0     0    0 n      (ECMP)
11    0        172.30.128.2/31      00:00:00:00:00:00 200001    0     0     0    0 n      (ECMP)
10    0        172.30.128.4/31      00:00:00:00:00:00 200001    0     0     0    0 n      (ECMP)
10    0        172.30.128.6/31      00:00:00:00:00:00 200001    0     0     0    0 n      (ECMP)
11    0        172.30.128.8/31      00:00:00:00:00:00 200001    0     0     0    0 n      (ECMP)
11    0        172.30.128.10/31     00:00:00:00:00:00 200001    0     0     0    0 n      (ECMP)
8     0        172.30.128.12/31     00:00:00:00:00:00 132827    0     0     0    2 n
8     0        172.30.128.14/31     00:00:00:00:00:00 132827    0     0     0    2 n
8     0        172.30.128.16/31     00:00:00:00:00:00 200005    0     0     0    0 n      (ECMP)
9     0        172.30.128.18/31     00:00:00:00:00:00 200005    0     0     0    0 n      (ECMP)
9     0        172.30.128.20/31     00:00:00:00:00:00 200005    0     0     0    0 n      (ECMP)
8     0        172.30.128.22/31     00:00:00:00:00:00 200005    0     0     0    0 n      (ECMP)
8     0        172.30.128.24/31     00:00:00:00:00:00 200005    0     0     0    0 n      (ECMP)
12    0        172.30.128.26/31     00:00:00:00:00:00 200005    0     0     0    0 n      (ECMP)
12    0        172.30.128.28/31     00:00:00:00:00:00 132827    0     0     0    2 n
12    0        172.30.128.30/31     00:00:00:00:00:00 132827    0     0     0    2 n
16    1        100.100.20.0/24      00:00:00:00:00:00 132827    0     0     0    2 n
24    2        100.100.120.0/24     00:00:00:00:00:00 132827    0     0     0    2 n
40    4        10.10.2.0/24         00:00:00:00:00:00 132827    0     0     0    2 y
40    4        10.10.3.0/24         00:00:00:00:00:00 132827    0     0     0    2 y
1     0        0.0.0.0/0            00:00:00:00:00:00 132826    0     0     0    0 y
2     1        0.0.0.0/0            00:00:00:00:00:00 132826    0     0     0    0 n
3     2        0.0.0.0/0            00:00:00:00:00:00 132826    0     0     0    0 n
4     3        0.0.0.0/0            00:00:00:00:00:00 132826    0     0     0    0 y
5     4        0.0.0.0/0            00:00:00:00:00:00 132826    0     0     0    0 y
```

**Comment by pau-hedgehog** [comment]
Additional findings:
```
drivshell>l3 egress show
l3 egress show
Entry  Mac                 Vlan INTF PORT MOD MPLS_LABEL ToCpu Drop RefCount L3MC
400002  1c:72:1d:9d:31:82 32772    5     5    0        -1   no   no    3   no
400003  1c:72:1d:9d:31:82 32773    6     6    0        -1   no   no    3   no
400004  0c:48:c6:15:38:83 32768    1     1    0        -1   no   no    1   no
400005  0c:48:c6:15:38:83 32769    2     2    0        -1   no   no    1   no
400006  54:bf:64:bd:ec:44 32770    3     3    0        -1   no   no    3   no
400007  54:bf:64:bd:ec:44 32771    4     4    0        -1   no   no    3   no
400008  00:00:00:00:00:00    0 16383    13    0        -1   no   no    2   no
400009  00:e0:ed:45:27:ff 29675    8    12    0        -1   no   no    1   no
400010  42:4c:e4:97:87:76 29674    7    10   -1        -1   no   no    1   no
400012  66:ab:8f:70:ec:0f 29674    7    11   -1        -1   no   no    1   no
132768  00:00:00:00:00:01    1 8192     0t   0        -1   no   no    0  yes
132769  00:00:00:00:00:01    1 8192     0t   0        -1   no   no    0   no
132770  00:00:00:00:00:00 29675   -1    58    0        -1   no   no    1   no
132771  00:00:00:00:00:00 29675   -1    58    0        -1   no   no    1   no
132772  00:00:00:00:00:00    0 16383     0    0        -1   no  yes    0   no
132773  00:00:00:00:00:00 29675   -1   123    0        -1   no   no    1   no
132774  00:00:00:00:00:00 29675   -1    71    0        -1   no   no    1   no
132775  00:00:00:00:00:00 29675   -1     1    0        -1   no   no    1   no
132776  00:00:00:00:00:00 29675   -1    33    0        -1   no   no    1   no
132777  00:00:00:00:00:00 29675   -1     0    0        -1   no   no    1   no
132778  00:00:00:00:00:00 29675   -1     0    0        -1   no   no    1   no
132779  00:00:00:00:00:00 29675   -1     0    0        -1   no   no    1   no
132780  00:00:00:00:00:00 29675   -1     1t   0        -1   no   no    1   no
132781  00:00:00:00:00:00 29675   -1     2t   0        -1   no   no    1   no
132782  00:00:00:00:00:00 29675   -1    50    0        -1   no   no    1   no
132783  54:bf:64:bd:ec:44 4095 8197   123    0        -1   no   no    2   no
432784  54:bf:64:bd:ec:44 4095 8197   123    0        -1   no   no    0  yes
132785  54:bf:64:bd:ec:44 4095 8198    71    0        -1   no   no    2   no
132786  1c:72:1d:9d:31:82 4095 8200    33    0        -1   no   no    2   no
132787  1c:72:1d:9d:31:82 4095 8199     1    0        -1   no   no    2   no
432788  54:bf:64:bd:ec:44 4095 8197   123    0        -1   no   no    0  yes
132826  8c:47:be:a9:85:91    1 8194     0    0        -1   no  yes   10   no
132827  8c:47:be:a9:85:91    0 16383     0    0        -1   no   no   28   no
drivshell>
```

Summary:
Route to 10.10.3.4 falls back to default route.
The default route uses egress object 132826.
Egress object 132826 punts traffic to the CPU.

**Comment by pau-hedgehog** [comment]
```
20:39:34 INF Discovering server IPs servers=9                                                                                                                                                                                        
20:39:34 INF Found server=server-9 addr=10.10.3.2/24                                                              
20:39:34 INF Found server=server-4 addr=10.10.2.2/24                                                                                                                                                                                 
20:39:34 INF Found server=server-5 addr=10.10.2.4/24                                                              
20:39:34 INF Found server=server-1 addr=10.10.1.2/24                                                                                                                                                                                 
20:39:34 INF Found server=server-2 addr=10.10.1.4/24                                                                                                                                                                                 
20:39:34 INF Found server=server-8 addr=10.10.3.3/24     
20:39:34 INF Found server=server-6 addr=10.10.2.3/24                                                                                                                                                                                 
20:39:34 INF Found server=server-3 addr=10.10.1.3/24                                                              
20:39:34 INF Found server=server-7 addr=10.10.3.4/24 
```

Focusing now on this error:
`Error key=vpcpeer--server-8--server-5 err="checking iperf from server-8 to server-5: running iperf3: iperf3 send speed too low: 1264.20 Mbps < 8200.00 Mbps"`

server-5 to server-8 seems to go through the CPU as well:
```
core@server-5 ~ $ toolbox iperf3 -c 10.10.3.3
Spawning container core-ghcr.iogithedgehogtoolbox-latest on /var/lib/toolbox/core-ghcr.io_githedgehog_toolbox-latest.
Press Ctrl-] three times within 1s to kill container.
Connecting to host 10.10.3.3, port 5201
[  5] local 10.10.2.4 port 35784 connected to 10.10.3.3 port 5201
[ ID] Interval           Transfer     Bitrate         Retr  Cwnd
[  5]   0.00-1.00   sec  3.10 MBytes  26.0 Mbits/sec    0    161 KBytes       
[  5]   1.00-2.00   sec  3.11 MBytes  26.1 Mbits/sec    0    303 KBytes       
[  5]   2.00-3.00   sec  2.92 MBytes  24.5 Mbits/sec    0    440 KBytes       
[  5]   3.00-4.00   sec  3.36 MBytes  28.2 Mbits/sec    0    581 KBytes       
[  5]   4.00-5.00   sec  2.73 MBytes  22.9 Mbits/sec    0    723 KBytes       
[  5]   5.00-6.00   sec  3.42 MBytes  28.7 Mbits/sec    0    864 KBytes       
[  5]   6.00-7.00   sec  2.98 MBytes  25.0 Mbits/sec    0   1005 KBytes       
[  5]   7.00-8.00   sec  3.36 MBytes  28.2 Mbits/sec    0   1.12 MBytes       
[  5]   8.00-9.00   sec  2.49 MBytes  20.9 Mbits/sec    0   1.26 MBytes       
[  5]   9.00-10.00  sec  2.50 MBytes  21.0 Mbits/sec    0   1.39 MBytes       
- - - - - - - - - - - - - - - - - - - - - - - - -
[ ID] Interval           Transfer     Bitrate         Retr
[  5]   0.00-10.00  sec  30.0 MBytes  25.1 Mbits/sec    0             sender
[  5]   0.00-10.54  sec  28.8 MBytes  22.9 Mbits/sec                  receiver

iperf Done.
```

server-8 to server-5:
```
core@server-8 ~ $ toolbox iperf3 -c 10.10.2.4
Spawning container core-ghcr.iogithedgehogtoolbox-latest on /var/lib/toolbox/core-ghcr.io_githedgehog_toolbox-latest.
Press Ctrl-] three times within 1s to kill container.
Connecting to host 10.10.2.4, port 5201
[  5] local 10.10.3.3 port 51534 connected to 10.10.2.4 port 5201
[ ID] Interval           Transfer     Bitrate         Retr  Cwnd
[  5]   0.00-1.00   sec   190 MBytes  1.59 Gbits/sec    0   3.35 MBytes       
[  5]   1.00-2.00   sec   170 MBytes  1.43 Gbits/sec    0   3.35 MBytes       
[  5]   2.00-3.00   sec   178 MBytes  1.49 Gbits/sec    0   3.35 MBytes       
[  5]   3.00-4.00   sec   165 MBytes  1.38 Gbits/sec    0   3.35 MBytes       
[  5]   4.00-5.00   sec   172 MBytes  1.45 Gbits/sec    0   3.35 MBytes       
[  5]   5.00-6.00   sec   176 MBytes  1.48 Gbits/sec    0   3.35 MBytes       
[  5]   6.00-7.00   sec   176 MBytes  1.48 Gbits/sec    0   3.35 MBytes       
[  5]   7.00-8.00   sec   182 MBytes  1.53 Gbits/sec    0   3.35 MBytes       
[  5]   8.00-9.00   sec   175 MBytes  1.47 Gbits/sec    0   3.35 MBytes       
[  5]   9.00-10.00  sec   189 MBytes  1.58 Gbits/sec    0   3.35 MBytes       
- - - - - - - - - - - - - - - - - - - - - - - - -
[ ID] Interval           Transfer     Bitrate         Retr
[  5]   0.00-10.00  sec  1.73 GBytes  1.49 Gbits/sec    0             sender
[  5]   0.00-10.04  sec  1.73 GBytes  1.48 Gbits/sec                  receiver

iperf Done.
Container core-ghcr.iogithedgehogtoolbox-latest exited successfully.
```

From `server-8`:

```bash
core@server-8 ~ $ ip addr show enp2s1.1003       
18: enp2s1.1003@enp2s1: <BROADCAST,MULTICAST,UP,LOWER_UP> mtu 1500 qdisc noqueue state UP group default qlen 1000
    link/ether 00:e0:ed:45:28:01 brd ff:ff:ff:ff:ff:ff
    inet 10.10.3.3/24 metric 1024 brd 10.10.3.255 scope global dynamic enp2s1.1003
       valid_lft 1396sec preferred_lft 1396sec
    inet6 fe80::2e0:edff:fe45:2801/64 scope link proto kernel_ll 
       valid_lft forever preferred_lft forever
```

This throughput is far below expected for a 10G link. We observe TCP ACKs on the CPU:
```
11:32:41.253703 IP 10.10.2.4.5201 > 10.10.3.3.33080: Flags [.], ack 1914635742, win 26784, options [nop,nop,TS val 1937118253 ecr 3051633014], length 0                                                                              
11:32:41.253737 IP 10.10.2.4.5201 > 10.10.3.3.33080: Flags [.], ack 1914661806, win 26784, options [nop,nop,TS val 1937118253 ecr 3051633014], length 0                                                                              
11:32:41.253769 IP 10.10.2.4.5201 > 10.10.3.3.33080: Flags [.], ack 1914700902, win 26727, options [nop,nop,TS val 1937118253 ecr 3051633014], length 0
11:32:41.253801 IP 10.10.2.4.5201 > 10.10.3.3.33080: Flags [.], ack 1914734206, win 26927, options [nop,nop,TS val 1937118253 ecr 3051633014], length 0
11:32:41.253833 IP 10.10.2.4.5201 > 10.10.3.3.33080: Flags [.], ack 1914828326, win 26639, options [nop,nop,TS val 1937118254 ecr 3051633014], length 0
11:32:41.253866 IP 10.10.2.4.5201 > 10.10.3.3.33080: Flags [.], ack 1914879006, win 26850, options [nop,nop,TS val 1937118254 ecr 3051633014], length 0
11:32:41.253898 IP 10.10.2.4.5201 > 10.10.3.3.33080: Flags [.], ack 1914896382, win 26927, options [nop,nop,TS val 1937118254 ecr 3051633014], length 0
11:32:41.253930 IP 10.10.2.4.5201 > 10.10.3.3.33080: Flags [.], ack 1914900726, win 26927, options [nop,nop,TS val 1937118258 ecr 3051633019], length 0
11:32:41.253963 IP 10.10.2.4.5201 > 10.10.3.3.33080: Flags [.], ack 1915293134, win 24375, options [nop,nop,TS val 1937118266 ecr 3051633026], length 0
11:32:41.253995 IP 10.10.2.4.5201 > 10.10.3.3.33080: Flags [.], ack 1915417662, win 24474, options [nop,nop,TS val 1937118266 ecr 3051633026], length 0
11:32:41.254027 IP 10.10.2.4.5201 > 10.10.3.3.33080: Flags [.], ack 1915517574, win 24617, options [nop,nop,TS val 1937118266 ecr 3051633026], length 0
11:32:41.254060 IP 10.10.2.4.5201 > 10.10.3.3.33080: Flags [.], ack 1915601558, win 24983, options [nop,nop,TS val 1937118266 ecr 3051633026], length 0
11:32:41.260163 IP 10.10.2.4.5201 > 10.10.3.3.33080: Flags [.], ack 1915684094, win 24992, options [nop,nop,TS val 1937118266 ecr 3051633027], length 0
11:32:41.260205 IP 10.10.2.4.5201 > 10.10.3.3.33080: Flags [.], ack 1915812966, win 25282, options [nop,nop,TS val 1937118266 ecr 3051633027], length 0
11:32:41.260238 IP 10.10.2.4.5201 > 10.10.3.3.33080: Flags [.], ack 1915905638, win 25596, options [nop,nop,TS val 1937118266 ecr 3051633027], length 0
11:32:41.260270 IP 10.10.2.4.5201 > 10.10.3.3.33080: Flags [.], ack 1915995414, win 26316, options [nop,nop,TS val 1937118266 ecr 3051633027], length 0
11:32:41.260303 IP 10.10.2.4.5201 > 10.10.3.3.33080: Flags [.], ack 1916031614, win 26650, options [nop,nop,TS val 1937118266 ecr 3051633027], length 0
11:32:41.260335 IP 10.10.2.4.5201 > 10.10.3.3.33080: Flags [.], ack 1916075054, win 26311, options [nop,nop,TS val 1937118267 ecr 3051633027], length 0
11:32:41.260368 IP 10.10.2.4.5201 > 10.10.3.3.33080: Flags [.], ack 1916211166, win 25938, options [nop,nop,TS val 1937118267 ecr 3051633027], length 0
11:32:41.260400 IP 10.10.2.4.5201 > 10.10.3.3.33080: Flags [.], ack 1916276326, win 26484, options [nop,nop,TS val 1937118272 ecr 3051633032], length 0
11:32:41.260432 IP 10.10.2.4.5201 > 10.10.3.3.33080: Flags [.], ack 1916603574, win 24375, options [nop,nop,TS val 1937118272 ecr 3051633032], length 0
11:32:41.260464 IP 10.10.2.4.5201 > 10.10.3.3.33080: Flags [.], ack 1916732446, win 24262, options [nop,nop,TS val 1937118272 ecr 3051633032], length 0
11:32:41.260496 IP 10.10.2.4.5201 > 10.10.3.3.33080: Flags [.], ack 1916826566, win 24483, options [nop,nop,TS val 1937118272 ecr 3051633032], length 0
11:32:41.260528 IP 10.10.2.4.5201 > 10.10.3.3.33080: Flags [.], ack 1916949646, win 24948, options [nop,nop,TS val 1937118272 ecr 3051633032], length 0
11:32:41.260560 IP 10.10.2.4.5201 > 10.10.3.3.33080: Flags [.], ack 1917063318, win 24716, options [nop,nop,TS val 1937118272 ecr 3051633033], length 0
11:32:41.266661 IP 10.10.2.4.5201 > 10.10.3.3.33080: Flags [.], ack 1917158886, win 24972, options [nop,nop,TS val 1937118272 ecr 3051633033], length 0
11:32:41.266702 IP 10.10.2.4.5201 > 10.10.3.3.33080: Flags [.], ack 1917247214, win 25337, options [nop,nop,TS val 1937118272 ecr 3051633033], length 0
11:32:41.266735 IP 10.10.2.4.5201 > 10.10.3.3.33080: Flags [.], ack 1917342782, win 25715, options [nop,nop,TS val 1937118272 ecr 3051633033], length 0
11:32:41.266768 IP 10.10.2.4.5201 > 10.10.3.3.33080: Flags [.], ack 1917423870, win 26017, options [nop,nop,TS val 1937118273 ecr 3051633033], length 0
11:32:41.267267 IP 10.10.2.4.5201 > 10.10.3.3.33080: Flags [.], ack 1917515094, win 26925, options [nop,nop,TS val 1937118273 ecr 3051633033], length 0
11:32:41.267322 IP 10.10.2.4.5201 > 10.10.3.3.33080: Flags [.], ack 1917522334, win 26927, options [nop,nop,TS val 1937118273 ecr 3051633033], length 0
11:32:41.267354 IP 10.10.2.4.5201 > 10.10.3.3.33080: Flags [.], ack 1917914742, win 24397, options [nop,nop,TS val 1937118279 ecr 3051633039], length 0
11:32:41.267385 IP 10.10.2.4.5201 > 10.10.3.3.33080: Flags [.], ack 1918023342, win 24472, options [nop,nop,TS val 1937118279 ecr 3051633039], length 0
11:32:41.267417 IP 10.10.2.4.5201 > 10.10.3.3.33080: Flags [.], ack 1918137734, win 24871, options [nop,nop,TS val 1937118279 ecr 3051633039], length 0
11:32:41.267449 IP 10.10.2.4.5201 > 10.10.3.3.33080: Flags [.], ack 1918230406, win 24981, options [nop,nop,TS val 1937118279 ecr 3051633039], length 0
11:32:41.267480 IP 10.10.2.4.5201 > 10.10.3.3.33080: Flags [.], ack 1918323078, win 25072, options [nop,nop,TS val 1937118279 ecr 3051633040], length 0
11:32:41.267512 IP 10.10.2.4.5201 > 10.10.3.3.33080: Flags [.], ack 1918424438, win 25484, options [nop,nop,TS val 1937118279 ecr 3051633040], length 0
11:32:41.267543 IP 10.10.2.4.5201 > 10.10.3.3.33080: Flags [.], ack 1918501182, win 25695, options [nop,nop,TS val 1937118279 ecr 3051633040], length 0
11:32:41.273160 IP 10.10.2.4.5201 > 10.10.3.3.33080: Flags [.], ack 1918603990, win 26072, options [nop,nop,TS val 1937118279 ecr 3051633040], length 0
11:32:41.273199 IP 10.10.2.4.5201 > 10.10.3.3.33080: Flags [.], ack 1918685078, win 26393, options [nop,nop,TS val 1937118279 ecr 3051633040], length 0
11:32:41.273232 IP 10.10.2.4.5201 > 10.10.3.3.33080: Flags [.], ack 1918761822, win 26483, options [nop,nop,TS val 1937118279 ecr 3051633040], length 0
11:32:41.273263 IP 10.10.2.4.5201 > 10.10.3.3.33080: Flags [F.], seq 1, ack 1918761822, win 26927, options [nop,nop,TS val 1937118282 ecr 3051633040], length 0
11:32:41.273295 IP 10.10.2.4.5201 > 10.10.3.3.33074: Flags [P.], seq 5:6, ack 143, win 509, options [nop,nop,TS val 1937118282 ecr 3051633042], length 1
11:32:41.273327 IP 10.10.2.4.5201 > 10.10.3.3.33080: Flags [R], seq 358774127, win 0, length 0
11:32:41.273358 IP 10.10.2.4.5201 > 10.10.3.3.33080: Flags [R], seq 358774127, win 0, length 0
11:32:41.273390 IP 10.10.2.4.5201 > 10.10.3.3.33080: Flags [R], seq 358774127, win 0, length 0
11:32:41.314717 IP 10.10.2.4.5201 > 10.10.3.3.33074: Flags [.], ack 147, win 509, options [nop,nop,TS val 1937118339 ecr 3051633058], length 0
11:32:41.315144 IP 10.10.2.4.5201 > 10.10.3.3.33074: Flags [.], ack 435, win 507, options [nop,nop,TS val 1937118339 ecr 3051633100], length 0
11:32:41.315438 IP 10.10.2.4.5201 > 10.10.3.3.33074: Flags [P.], seq 6:10, ack 435, win 507, options [nop,nop,TS val 1937118339 ecr 3051633100], length 4
11:32:41.356215 IP 10.10.2.4.5201 > 10.10.3.3.33074: Flags [P.], seq 10:302, ack 435, win 507, options [nop,nop,TS val 1937118380 ecr 3051633141], length 292
11:32:41.357098 IP 10.10.2.4.5201 > 10.10.3.3.33074: Flags [F.], seq 302, ack 437, win 507, options [nop,nop,TS val 1937118381 ecr 3051633141], length 0
^C
82120 packets captured
82120 packets received by filter
0 packets dropped by kernel
```

Control Plane Forwarding Entries

```bash
s5248-03# show ip route vrf VrfVvpc-01
...
C>*   10.10.3.0/24       Direct                          Vlan1003                                   0/0           1d15h08m ago
```

```bash
s5248-03# show ip arp vrf VrfVvpc-01
...
10.10.3.3           00:e0:ed:45:28:01   Vlan1003             Ethernet1                   Dynamic            Fwd       
```

```bash
admin@s5248-03:~$ bcmcmd "l2 show" | grep -i 00:e0:ed:45:28:01
mac=00:e0:ed:45:28:01 vlan=29675 GPORT=0xb000000d port=0xb000000d(flow) Hit
```

```bash
admin@s5248-03:~$ bcmcmd "l3 defip show" | grep 10.10.3.0
32    3        10.10.3.0/24         00:00:00:00:00:00 132827    0     0     0    2 y
```

```bash
admin@s5248-03:~$ bcmcmd "l3 egress show" | grep -i 00:e0:ed:45:28:01
400010  00:e0:ed:45:28:01 29675    8    13    0        -1   no   no    1   no
```

All entries seem correctly installed in both software and Broadcom hardwareSONiC.

CPU Punt Counters:

```bash
admin@s5248-03:~$ bcmcmd "show c" | grep -i cpu
MC_PERQ_PKT(14).cpu0        :                70,905                  +3
MC_PERQ_PKT(18).cpu0        :               338,754                  +9
MC_PERQ_BYTE(14).cpu0       :            10,509,401                +260
MC_PERQ_BYTE(18).cpu0       :            97,284,582              +2,512
```

So it's the same issue as above

**Comment by pau-hedgehog** [comment]
This was raised to vendor in CS00012402411. Got confirmation it's a duplicate of https://github.com/githedgehog/fabricator/issues/495
