### ISSUE TITLE
Server is reachable via ICMP but other traffic is dropped

### ISSUE THREAD

**Issue by pau-hedgehog** [githedgehog/fabricator#496]
While running release-tests:
`./hhfab-dev vlab release-test --pause-on-fail --regex "Starter"`

It can randomly fail with:
```
13:55:03 ERR Error key=vpcpeer--server-7--server-6 err="checking ping from server-7 to server-6: should be reachable but ping failed with output: PING 10.10.6.2 (10.10.6.2) 56(84) bytes of data.\n\n--- 10.10.6.2 ping statistics ---\n3 packets transmitted, 0 received, 100% packet loss, time 2057ms"
13:55:03 ERR Error key=vpcpeer--server-6--server-7 err="checking ping from server-6 to server-7: unexpected ping result (expected true): PING 10.10.7.2 (10.10.7.2) 56(84) bytes of data.\n64 bytes from 10.10.7.2: icmp_seq=1 ttl=62 time=0.377 ms\n\n--- 10.10.7.2 ping statistics ---\n3 packets transmitted, 1 received, 66.6667% packet loss, time 2078ms\nrtt min/avg/max/mdev = 0.377/0.377/0.377/0.000 ms"
13:55:03 ERR Error key=vpcpeer--server-6--server-4 err="checking iperf from server-6 to server-4: running iperf3: running iperf3 server: Process exited with status 124: -----------------------------------------------------------\r\nServer listening on 5201\r\n-----------------------------------------------------------\r\ntimeout: sending signal TERM to command ‘iperf3’\r\niperf3: interrupt - the server has terminated\r\n"
```

![Image](https://github.com/user-attachments/assets/b72f177c-07cf-4eb3-afc1-677bfe5289be)

server-4 to server-6:
```
core@server-4 ~ $ ping 10.10.6.2
PING 10.10.6.2 (10.10.6.2) 56(84) bytes of data.
64 bytes from 10.10.6.2: icmp_seq=1 ttl=62 time=0.361 ms
64 bytes from 10.10.6.2: icmp_seq=2 ttl=62 time=0.291 ms
64 bytes from 10.10.6.2: icmp_seq=3 ttl=62 time=0.281 ms
64 bytes from 10.10.6.2: icmp_seq=4 ttl=62 time=0.295 ms
^C
--- 10.10.6.2 ping statistics ---
4 packets transmitted, 4 received, 0% packet loss, time 3049ms
rtt min/avg/max/mdev = 0.281/0.307/0.361/0.031 ms
core@server-4 ~ $ toolbox iperf3 -c 10.10.6.2
Spawning container core-ghcr.iogithedgehogtoolbox-latest on /var/lib/toolbox/core-ghcr.io_githedgehog_toolbox-latest.
Press Ctrl-] three times within 1s to kill container.
^C- - - - - - - - - - - - - - - - - - - - - - - - -
[ ID] Interval           Transfer     Bitrate         Retr
iperf3: interrupt - the client has terminated
Container core-ghcr.iogithedgehogtoolbox-latest failed with error code 1.
core@server-4 ~ $ toolbox iperf3 -c 10.10.6.2 -u
Spawning container core-ghcr.iogithedgehogtoolbox-latest on /var/lib/toolbox/core-ghcr.io_githedgehog_toolbox-latest.
Press Ctrl-] three times within 1s to kill container.
Connecting to host 10.10.6.2, port 5201
iperf3: error - unable to read from stream socket: Resource temporarily unavailable
Container core-ghcr.iogithedgehogtoolbox-latest failed with error code 1.
```

Server side iperf:
```
core@server-6 ~ $ toolbox iperf3 -s
Spawning container core-ghcr.iogithedgehogtoolbox-latest on /var/lib/toolbox/core-ghcr.io_githedgehog_toolbox-latest.
Press Ctrl-] three times within 1s to kill container.
-----------------------------------------------------------
Server listening on 5201
-----------------------------------------------------------
Accepted connection from 10.10.4.2, port 48468
-----------------------------------------------------------
Server listening on 5201
-----------------------------------------------------------
^Ciperf3: interrupt - the server has terminated
```

Between server 6 and 7 there's no connectivity at all:
```
core@server-6 ~ $ ping 10.10.7.2
PING 10.10.7.2 (10.10.7.2) 56(84) bytes of data.
^C
--- 10.10.7.2 ping statistics ---
4 packets transmitted, 0 received, 100% packet loss, time 3106ms
```

**Comment by pau-hedgehog** [comment]
```
ubuntu@env-1:~/hhfab$ ./hhfab-dev versions
15:48:45 INF Hedgehog Fabricator version=v0.35.0-44-g62216e0f-8F2153
15:48:45 INF Wiring hydrated successfully mode=if-not-present
15:48:45 INF Printing versions of all components
fabric:
  agent: v0.71.0
  alloy: v1.1.1
  api: v0.71.0
  boot: v0.71.0
  controller: v0.71.0
  ctl: v0.71.0
  dhcpd: v0.71.0
  nos:
    sonic-bcm-base: v4.4.2
    sonic-bcm-campus: v4.4.2
    sonic-bcm-vs: v4.4.2
  onie:
    x86_64-accton_as4630_54npe-r0: v0.1.0
    x86_64-accton_as7326_56x-r0: v0.1.0
    x86_64-accton_as7712_32x-r0: v0.1.0
    x86_64-accton_as7726_32x-r0: v0.1.0
    x86_64-cel_ds4101-r0: v0.2.0
    x86_64-cel_seastone_2-r0: v0.1.0
    x86_64-cel_silverstone-r0: v0.1.0
    x86_64-dellemc_s5232f_c3538-r0: v0.1.0
    x86_64-dellemc_s5248f_c3538-r0: v0.1.0
    x86_64-dellemc_z9332f_d1508-r0: v0.1.0
    x86_64-kvm_x86_64-r0: v0.1.0
  proxy: 1.9.1
  proxyChart: v0.71.0
fabricator:
  api: v0.35.0-44-g62216e0f-8F2153
  controlISORoot: v4152.2.0-hh1
  controller: v0.35.0-44-g62216e0f-8F2153
  ctl: v0.35.0-44-g62216e0f-8F2153
  flatcar: v4152.2.0
gateway: {}
platform:
  certManager: v1.17.1
  k3s: v1.32.1-k3s1
  k9s: v0.40.6
  ntp: v0.0.2
  ntpChart: v0.35.0-44-g62216e0f-8F2153
  reloader: v1.0.40
  toolbox: latest
  zot: v2.1.1
vlab:
  flatcar: v4152.2.0
  onie: v0.2.0
```

[evpn_tshooting_4_6_not_working.tar.gz](https://github.com/user-attachments/files/19471950/evpn_tshooting_4_6_not_working.tar.gz)
[show-tech-4_6_not_working.tar.gz](https://github.com/user-attachments/files/19471951/show-tech-4_6_not_working.tar.gz)

**Comment by pau-hedgehog** [comment]
Tracing traffic via mirroring as per https://www.dell.com/support/kbdoc/en-uk/000218349/dell-networking-sonic-how-to-capture-packets-on-a-port-port-mirroring

Eventually traffic starts passing:
```
core@server-4 ~ $ toolbox iperf3 -c 10.10.6.2
Spawning container core-ghcr.iogithedgehogtoolbox-latest on /var/lib/toolbox/core-ghcr.io_githedgehog_toolbox-latest.
Press Ctrl-] three times within 1s to kill container.
Connecting to host 10.10.6.2, port 5201
[  5] local 10.10.4.2 port 42354 connected to 10.10.6.2 port 5201
[ ID] Interval           Transfer     Bitrate         Retr  Cwnd
[  5]   0.00-1.00   sec  1.08 GBytes  9.30 Gbits/sec   16   1.34 MBytes       
[  5]   1.00-2.00   sec  1.09 GBytes  9.38 Gbits/sec    1   1.39 MBytes       
[  5]   2.00-3.00   sec  1.09 GBytes  9.37 Gbits/sec   35   1.40 MBytes       
[  5]   3.00-4.00   sec  1.09 GBytes  9.38 Gbits/sec    0   1.41 MBytes       
[  5]   4.00-5.00   sec  1.09 GBytes  9.38 Gbits/sec    0   1.42 MBytes       
[  5]   5.00-6.00   sec  1.09 GBytes  9.37 Gbits/sec    0   1.44 MBytes       
[  5]   6.00-7.00   sec  1.09 GBytes  9.38 Gbits/sec    0   1.44 MBytes       
[  5]   7.00-8.00   sec  1.09 GBytes  9.38 Gbits/sec    0   1.47 MBytes       
[  5]   8.00-9.00   sec  1.09 GBytes  9.38 Gbits/sec    0   1.51 MBytes       
[  5]   9.00-10.00  sec  1.09 GBytes  9.38 Gbits/sec    0   1.58 MBytes       
- - - - - - - - - - - - - - - - - - - - - - - - -
[ ID] Interval           Transfer     Bitrate         Retr
[  5]   0.00-10.00  sec  10.9 GBytes  9.37 Gbits/sec   52             sender
[  5]   0.00-10.04  sec  10.9 GBytes  9.33 Gbits/sec                  receiver

iperf Done.
Container core-ghcr.iogithedgehogtoolbox-latest exited successfully.
```

**Comment by pau-hedgehog** [comment]
And eventually stops passing. From the mirror session destined to server-2:
```
s5248-02# show mirror-session 
SPAN Sessions
-------------------------------------------------------------------------------
Name                     Status     DST-Port         SRC-Port         Direction 
-------------------------------------------------------------------------------
E_1_4__E_1_3             active     Ethernet2        Ethernet3        both 
```

![Image](https://github.com/user-attachments/assets/c9ddc117-ec44-4f6d-bde2-9e2b7c7c19af)

```
18:28:53.560265 IP 10.10.4.2 > 10.10.6.2: ICMP echo request, id 228, seq 1, length 64
18:28:53.560398 IP 10.10.6.2 > 10.10.4.2: ICMP echo reply, id 228, seq 1, length 64
18:28:54.561066 IP 10.10.4.2 > 10.10.6.2: ICMP echo request, id 228, seq 2, length 64
18:28:54.561160 IP 10.10.6.2 > 10.10.4.2: ICMP echo reply, id 228, seq 2, length 64
18:28:55.585052 IP 10.10.4.2 > 10.10.6.2: ICMP echo request, id 228, seq 3, length 64
18:28:55.585151 IP 10.10.6.2 > 10.10.4.2: ICMP echo reply, id 228, seq 3, length 64
18:28:56.609062 IP 10.10.4.2 > 10.10.6.2: ICMP echo request, id 228, seq 4, length 64
18:28:56.609159 IP 10.10.6.2 > 10.10.4.2: ICMP echo reply, id 228, seq 4, length 64
18:28:57.633049 IP 10.10.4.2 > 10.10.6.2: ICMP echo request, id 228, seq 5, length 64
18:28:57.633160 IP 10.10.6.2 > 10.10.4.2: ICMP echo reply, id 228, seq 5, length 64
18:29:03.092847 IP 10.10.4.2.52588 > 10.10.6.2.5201: Flags [S], seq 468217877, win 64240, options [mss 1460,sackOK,TS val 275170168 ecr 0,nop,wscale 7], length 0
18:29:04.096999 IP 10.10.4.2.52588 > 10.10.6.2.5201: Flags [S], seq 468217877, win 64240, options [mss 1460,sackOK,TS val 275171173 ecr 0,nop,wscale 7], length 0
18:29:05.121007 IP 10.10.4.2.52588 > 10.10.6.2.5201: Flags [S], seq 468217877, win 64240, options [mss 1460,sackOK,TS val 275172197 ecr 0,nop,wscale 7], length 0
18:29:06.144997 IP 10.10.4.2.52588 > 10.10.6.2.5201: Flags [S], seq 468217877, win 64240, options [mss 1460,sackOK,TS val 275173221 ecr 0,nop,wscale 7], length 0
18:29:07.168990 IP 10.10.4.2.52588 > 10.10.6.2.5201: Flags [S], seq 468217877, win 64240, options [mss 1460,sackOK,TS val 275174245 ecr 0,nop,wscale 7], length 0
18:29:08.192959 IP 10.10.4.2.52588 > 10.10.6.2.5201: Flags [S], seq 468217877, win 64240, options [mss 1460,sackOK,TS val 275175269 ecr 0,nop,wscale 7], length 0
18:29:10.240942 IP 10.10.4.2.52588 > 10.10.6.2.5201: Flags [S], seq 468217877, win 64240, options [mss 1460,sackOK,TS val 275177317 ecr 0,nop,wscale 7], length 0
18:29:12.388628 IP 0.0.0.0.bootpc > 255.255.255.255.bootps: BOOTP/DHCP, Request from 00:e0:ed:7a:e4:49 (oui Unknown), length 293
18:29:14.273000 IP 10.10.4.2.52588 > 10.10.6.2.5201: Flags [S], seq 468217877, win 64240, options [mss 1460,sackOK,TS val 275181349 ecr 0,nop,wscale 7], length 0
18:29:22.401009 IP 10.10.4.2.52588 > 10.10.6.2.5201: Flags [S], seq 468217877, win 64240, options [mss 1460,sackOK,TS val 275189477 ecr 0,nop,wscale 7], length 0
```

**Comment by pau-hedgehog** [comment]
Raised Case CS00012398131

**Comment by pau-hedgehog** [comment]
> Raised Case CS00012398131

Case update:

> From what you mentioned, please help to confirm whether the issue is
related to network connectivity/SONiC switch; I did not see pkts drops
(tx/rx) on all leaf/spine switches; can you run ping with large number
count pkts to verify? is there any abnormal ping latency which might affect
TCP/UDP connection? you also can run traceroute to verify.

Trying to reproduce as this one is not hit so often

**Comment by pau-hedgehog** [comment]
I hit this behavior also in https://github.com/githedgehog/fabricator/issues/564

Requesting confirmation in CS00012398131, just to be sure that we are not overlooking any upstream bug and we don't get a timely fix in 4.5.0
